{"schema_version":"home-lab-workload-inventory/v1","projection_profile":"process-container/v1","source_id":"srv_0123456789abcdef0123456789abcdef","collector_version":"0.2.0-canary.1","collected_at":"2026-10-29T12:00:00Z","policy":{"data_classification":"SENSITIVE","read_only":true,"processes_enabled":false,"containers_enabled":false},"processes":{"quality":{"state":"DISABLED","reason_code":"DISABLED_BY_CONFIGURATION"},"cpu_measurement_basis":"LIFETIME_SINGLE_CORE","observed_at":null,"returned_count":0,"total_count":null,"truncated":false,"items":[]},"containers":{"quality":{"state":"DISABLED","reason_code":"DISABLED_BY_CONFIGURATION"},"cpu_measurement_basis":"ENGINE_HOST_CAPACITY","observed_at":null,"returned_count":0,"total_count":null,"truncated":false,"items":[]}}
