{"schema_version":"home-lab-workload-inventory/v1","projection_profile":"process-container/v1","source_id":"srv_0123456789abcdef0123456789abcdef","collector_version":"0.2.0-canary.1","collected_at":"2026-10-29T12:00:00Z","policy":{"data_classification":"SENSITIVE","read_only":true,"processes_enabled":true,"containers_enabled":true},"processes":{"quality":{"state":"AVAILABLE","reason_code":null},"cpu_measurement_basis":"LIFETIME_SINGLE_CORE","observed_at":"2026-10-29T12:00:00Z","returned_count":1,"total_count":1,"truncated":false,"items":[{"pid":42,"name":"sample-worker","state":"sleeping","cpu_percent":0,"memory_rss_bytes":2048,"elapsed_seconds":12}]},"containers":{"quality":{"state":"DEGRADED","reason_code":"PARTIAL_COLLECTION"},"cpu_measurement_basis":"ENGINE_HOST_CAPACITY","observed_at":"2026-10-29T12:00:00Z","returned_count":2,"total_count":2,"truncated":false,"items":[{"id_alias":"ctr_0000000000000001","name":"sample-service","image":"example.invalid/sample:1","state":"running","cpu_percent":null,"memory_bytes":4096,"metrics_state":"PARTIAL","reason_code":"INVALID_COUNTER"},{"id_alias":"ctr_0000000000000002","name":"sample-stopped","image":"example.invalid/sample:1","state":"exited","cpu_percent":null,"memory_bytes":null,"metrics_state":"NOT_RUNNING","reason_code":"NOT_RUNNING"}]}}
